{
  "$schema": "https://json-schema.org/draft/2020-12/schema",
  "$id": "https://ai-training-platform.local/contracts/challenge.schema.json",
  "title": "Challenge",
  "type": "object",
  "additionalProperties": false,
  "required": [
    "schemaVersion",
    "id",
    "version",
    "title",
    "origin",
    "zone",
    "languagePolicy",
    "deliveryPolicy",
    "rubricVersion",
    "submissionContract"
  ],
  "properties": {
    "schemaVersion": { "const": "1.0" },
    "id": { "type": "string", "pattern": "^[a-z0-9][a-z0-9-]{2,63}$" },
    "version": { "type": "integer", "minimum": 1 },
    "title": { "type": "string", "minLength": 1, "maxLength": 200 },
    "description": { "type": "string", "maxLength": 2000 },
    "objectives": { "type": "array", "items": { "type": "string", "maxLength": 500 }, "maxItems": 20 },
    "requirements": { "type": "array", "items": { "type": "string", "maxLength": 1000 }, "maxItems": 50 },
    "constraints": { "type": "array", "items": { "type": "string", "maxLength": 1000 }, "maxItems": 50 },
    "deliverables": { "type": "array", "items": { "type": "string", "maxLength": 500 }, "maxItems": 20 },
    "tags": { "type": "array", "items": { "type": "string", "maxLength": 50 }, "uniqueItems": true, "maxItems": 20 },
    "estimatedMinutes": { "type": "integer", "minimum": 1, "maximum": 10080 },
    "origin": { "enum": ["official", "crowdsourced", "bounty", "explore"] },
    "zone": { "enum": ["blue", "yellow"] },
    "ownerOrgPath": { "type": "string", "pattern": "^(/[A-Za-z0-9_-]+)+/$" },
    "languagePolicy": {
      "type": "object",
      "additionalProperties": false,
      "required": ["mode", "languages"],
      "properties": {
        "mode": { "enum": ["fixed", "free"] },
        "languages": {
          "type": "array",
          "minItems": 1,
          "uniqueItems": true,
          "items": { "enum": ["python", "java", "go"] }
        }
      }
    },
    "deliveryPolicy": {
      "type": "object",
      "additionalProperties": false,
      "required": ["allowedSources"],
      "properties": {
        "allowedSources": {
          "type": "array",
          "minItems": 1,
          "uniqueItems": true,
          "items": { "enum": ["UPLOAD", "GIT_REF"] }
        },
        "upload": {
          "type": "object",
          "additionalProperties": false,
          "required": ["formats", "maxBytes", "maxFiles"],
          "properties": {
            "formats": { "type": "array", "minItems": 1, "items": { "enum": ["zip", "tar.gz"] } },
            "maxBytes": { "type": "integer", "minimum": 1, "maximum": 1073741824 },
            "maxFiles": { "type": "integer", "minimum": 1, "maximum": 100000 },
            "allowResubmit": { "type": "boolean", "default": true }
          }
        },
        "git": {
          "type": "object",
          "additionalProperties": false,
          "required": ["provider", "repository", "pinAt", "credentialRef"],
          "properties": {
            "provider": { "const": "GITLAB" },
            "repository": { "type": "string", "pattern": "^[A-Za-z0-9_.-]+(/[A-Za-z0-9_.-]+)+$" },
            "branch": { "type": "string", "minLength": 1, "maxLength": 200 },
            "branchTemplate": { "type": "string", "pattern": "^[A-Za-z0-9_./{}-]+$" },
            "pinAt": { "enum": ["SUBMIT", "DEADLINE"] },
            "credentialRef": { "type": "string", "pattern": "^[A-Za-z0-9_.-]+$" }
          },
          "oneOf": [
            { "required": ["branch"] },
            { "required": ["branchTemplate"] }
          ]
        }
      },
      "allOf": [
        {
          "if": { "properties": { "allowedSources": { "contains": { "const": "UPLOAD" } } } },
          "then": { "required": ["upload"] }
        },
        {
          "if": { "properties": { "allowedSources": { "contains": { "const": "GIT_REF" } } } },
          "then": { "required": ["git"] }
        }
      ]
    },
    "rubricVersion": { "type": "string", "pattern": "^[0-9]+\\.[0-9]+$" },
    "submissionContract": { "type": "string", "minLength": 1 },
    "requiredRepos": { "type": "array", "items": { "type": "string" }, "uniqueItems": true },
    "tests": {
      "type": "object",
      "additionalProperties": false,
      "properties": {
        "public": { "type": "array", "items": { "type": "string" } },
        "hidden": { "type": "array", "items": { "type": "string" } },
        "golden": { "type": "array", "items": { "type": "string" } }
      }
    },
    "resources": {
      "type": "object",
      "additionalProperties": false,
      "properties": {
        "starter": { "type": "string" },
        "reference": { "type": "string" },
        "attachments": { "type": "array", "items": { "type": "string" } }
      }
    },
    "resourceLimits": {
      "type": "object",
      "additionalProperties": false,
      "properties": {
        "timeoutSeconds": { "type": "integer", "minimum": 1, "maximum": 3600 },
        "memoryMb": { "type": "integer", "minimum": 64, "maximum": 65536 },
        "maxOutputBytes": { "type": "integer", "minimum": 1024, "maximum": 1073741824 }
      }
    },
    "changePackage": { "type": "object", "additionalProperties": true },
    "visibility": { "enum": ["PUBLIC", "ORG", "PRIVATE"] },
    "bounty": { "type": "number", "minimum": 0 },
    "explore": { "type": "boolean" },
    "metadata": { "type": "object", "additionalProperties": true }
  }
}
